{
  "schemaVersion": 1,
  "suite": "OPENCHAMBER-E2E-NFL-1",
  "runAtUtc": "2026-10-20T22:57:02.298Z",
  "status": "PARTIAL",
  "runner": {
    "name": "Playwright",
    "version": "1.64.1",
    "browser": "chromium",
    "browserVersion": "156.0.8078.4"
  },
  "gitRef": "merge/v20-donor",
  "gitCommit": "ff8c05ae0ef89e9030faa991a942d1c611f891bd",
  "artifactPath": "/Users/kosi/Desktop/Football Sim/merged.html",
  "artifactSha256": "40233d6be00e987c472cf6b1126b0ab7f11c123006277466bd23391b308795fd",
  "steps": [
    {
      "id": "initial-load",
      "status": "PASS",
      "startedAtUtc": "2026-10-20T22:57:03.369Z",
      "durationMs": 3070,
      "details": "Title: NFL Draft Simulator; Heading: NFL Draft Simulator"
    },
    {
      "id": "start-draft",
      "status": "PASS",
      "startedAtUtc": "2026-10-20T22:57:06.439Z",
      "durationMs": 3229,
      "details": "Draft started, live view visible"
    },
    {
      "id": "select-instant-speed",
      "status": "PASS",
      "startedAtUtc": "2026-10-20T22:57:09.668Z",
      "durationMs": 439,
      "details": "Instant speed selected"
    },
    {
      "id": "sim-to-end",
      "status": "PASS",
      "startedAtUtc": "2026-10-20T22:57:10.107Z",
      "durationMs": 4138,
      "details": "Draft complete confirmed; internal pos: unavailable"
    },
    {
      "id": "click-results-season",
      "status": "PASS",
      "startedAtUtc": "2026-10-20T22:57:14.245Z",
      "durationMs": 2523,
      "details": "Season landing visible, startSeasonBtn present"
    },
    {
      "id": "start-season",
      "status": "PASS",
      "startedAtUtc": "2026-10-20T22:57:16.768Z",
      "durationMs": 3082,
      "details": "Preseason setup visible, beginSeasonBtn present"
    },
    {
      "id": "begin-season",
      "status": "PASS",
      "startedAtUtc": "2026-10-20T22:57:19.850Z",
      "durationMs": 3344,
      "details": "Season started, simSeasonBtn visible"
    },
    {
      "id": "week-1-display",
      "status": "SKIP",
      "startedAtUtc": "2026-10-20T22:57:23.194Z",
      "durationMs": 0,
      "details": "V20 donor build lacks persistent Week 1 display element (no #weekDisplay, #currentWeek, .week-indicator). Preseason setup shows 'Set up the ${user} before Week 1' text only. Protocol requires visible Week 1 of 17 display during regular season; marked SKIP per protocol (SKIP, never PASS)."
    },
    {
      "id": "sim-season",
      "status": "PASS",
      "startedAtUtc": "2026-10-20T22:57:23.194Z",
      "durationMs": 5562,
      "details": "Regular season complete; games played: unavailable (expected 272)"
    },
    {
      "id": "sim-playoffs",
      "status": "PASS",
      "startedAtUtc": "2026-10-20T22:57:28.756Z",
      "durationMs": 5474,
      "details": "Playoffs/Super Bowl complete; champion visible: true; rounds: unavailable"
    },
    {
      "id": "sim-100-seasons",
      "status": "PASS",
      "startedAtUtc": "2026-10-20T22:57:34.230Z",
      "durationMs": 14451,
      "details": "100-season report rendered; driven-winning section: true; duration: unavailablems"
    }
  ],
  "consoleErrors": [],
  "pageErrors": [],
  "viewportChecks": [
    {
      "checkpoint": "initial-load-desktop",
      "width": 1280,
      "height": 900,
      "documentScrollWidth": 1280,
      "bodyScrollWidth": 1280,
      "pageOverflowPx": 0,
      "overflowElements": [],
      "screenshot": "/Users/kosi/Desktop/Football Sim/test-results/e2e-1792537022298/viewport-initial-load-desktop.png"
    },
    {
      "checkpoint": "initial-load",
      "width": 390,
      "height": 844,
      "documentScrollWidth": 390,
      "bodyScrollWidth": 390,
      "pageOverflowPx": 0,
      "overflowElements": [],
      "screenshot": "/Users/kosi/Desktop/Football Sim/test-results/e2e-1792537022298/viewport-initial-load.png"
    },
    {
      "checkpoint": "live-draft-desktop",
      "width": 1280,
      "height": 900,
      "documentScrollWidth": 1280,
      "bodyScrollWidth": 1280,
      "pageOverflowPx": 0,
      "overflowElements": [],
      "screenshot": "/Users/kosi/Desktop/Football Sim/test-results/e2e-1792537022298/viewport-live-draft-desktop.png"
    },
    {
      "checkpoint": "live-draft",
      "width": 390,
      "height": 844,
      "documentScrollWidth": 390,
      "bodyScrollWidth": 390,
      "pageOverflowPx": 0,
      "overflowElements": [],
      "screenshot": "/Users/kosi/Desktop/Football Sim/test-results/e2e-1792537022298/viewport-live-draft.png"
    },
    {
      "checkpoint": "draft-results-desktop",
      "width": 1280,
      "height": 900,
      "documentScrollWidth": 1280,
      "bodyScrollWidth": 1280,
      "pageOverflowPx": 0,
      "overflowElements": [],
      "screenshot": "/Users/kosi/Desktop/Football Sim/test-results/e2e-1792537022298/viewport-draft-results-desktop.png"
    },
    {
      "checkpoint": "draft-results",
      "width": 390,
      "height": 844,
      "documentScrollWidth": 390,
      "bodyScrollWidth": 390,
      "pageOverflowPx": 0,
      "overflowElements": [],
      "screenshot": "/Users/kosi/Desktop/Football Sim/test-results/e2e-1792537022298/viewport-draft-results.png"
    },
    {
      "checkpoint": "preseason-desktop",
      "width": 1280,
      "height": 900,
      "documentScrollWidth": 1280,
      "bodyScrollWidth": 1280,
      "pageOverflowPx": 0,
      "overflowElements": [],
      "screenshot": "/Users/kosi/Desktop/Football Sim/test-results/e2e-1792537022298/viewport-preseason-desktop.png"
    },
    {
      "checkpoint": "preseason",
      "width": 390,
      "height": 844,
      "documentScrollWidth": 390,
      "bodyScrollWidth": 390,
      "pageOverflowPx": 0,
      "overflowElements": [],
      "screenshot": "/Users/kosi/Desktop/Football Sim/test-results/e2e-1792537022298/viewport-preseason.png"
    },
    {
      "checkpoint": "preseason-setup-desktop",
      "width": 1280,
      "height": 900,
      "documentScrollWidth": 1280,
      "bodyScrollWidth": 1280,
      "pageOverflowPx": 0,
      "overflowElements": [],
      "screenshot": "/Users/kosi/Desktop/Football Sim/test-results/e2e-1792537022298/viewport-preseason-setup-desktop.png"
    },
    {
      "checkpoint": "preseason-setup",
      "width": 390,
      "height": 844,
      "documentScrollWidth": 390,
      "bodyScrollWidth": 390,
      "pageOverflowPx": 0,
      "overflowElements": [],
      "screenshot": "/Users/kosi/Desktop/Football Sim/test-results/e2e-1792537022298/viewport-preseason-setup.png"
    },
    {
      "checkpoint": "season-started-desktop",
      "width": 1280,
      "height": 900,
      "documentScrollWidth": 1280,
      "bodyScrollWidth": 1280,
      "pageOverflowPx": 0,
      "overflowElements": [],
      "screenshot": "/Users/kosi/Desktop/Football Sim/test-results/e2e-1792537022298/viewport-season-started-desktop.png"
    },
    {
      "checkpoint": "season-started",
      "width": 390,
      "height": 844,
      "documentScrollWidth": 390,
      "bodyScrollWidth": 390,
      "pageOverflowPx": 0,
      "overflowElements": [],
      "screenshot": "/Users/kosi/Desktop/Football Sim/test-results/e2e-1792537022298/viewport-season-started.png"
    },
    {
      "checkpoint": "regular-season-review-desktop",
      "width": 1280,
      "height": 900,
      "documentScrollWidth": 1280,
      "bodyScrollWidth": 1280,
      "pageOverflowPx": 0,
      "overflowElements": [],
      "screenshot": "/Users/kosi/Desktop/Football Sim/test-results/e2e-1792537022298/viewport-regular-season-review-desktop.png"
    },
    {
      "checkpoint": "regular-season-review",
      "width": 390,
      "height": 844,
      "documentScrollWidth": 390,
      "bodyScrollWidth": 390,
      "pageOverflowPx": 0,
      "overflowElements": [],
      "screenshot": "/Users/kosi/Desktop/Football Sim/test-results/e2e-1792537022298/viewport-regular-season-review.png"
    },
    {
      "checkpoint": "playoffs-champion-desktop",
      "width": 1280,
      "height": 900,
      "documentScrollWidth": 1280,
      "bodyScrollWidth": 1280,
      "pageOverflowPx": 0,
      "overflowElements": [],
      "screenshot": "/Users/kosi/Desktop/Football Sim/test-results/e2e-1792537022298/viewport-playoffs-champion-desktop.png"
    },
    {
      "checkpoint": "playoffs-champion",
      "width": 390,
      "height": 844,
      "documentScrollWidth": 390,
      "bodyScrollWidth": 390,
      "pageOverflowPx": 0,
      "overflowElements": [],
      "screenshot": "/Users/kosi/Desktop/Football Sim/test-results/e2e-1792537022298/viewport-playoffs-champion.png"
    },
    {
      "checkpoint": "100-season-report-desktop",
      "width": 1280,
      "height": 900,
      "documentScrollWidth": 1280,
      "bodyScrollWidth": 1280,
      "pageOverflowPx": 0,
      "overflowElements": [],
      "screenshot": "/Users/kosi/Desktop/Football Sim/test-results/e2e-1792537022298/viewport-100-season-report-desktop.png"
    },
    {
      "checkpoint": "100-season-report",
      "width": 390,
      "height": 844,
      "documentScrollWidth": 390,
      "bodyScrollWidth": 390,
      "pageOverflowPx": 0,
      "overflowElements": [],
      "screenshot": "/Users/kosi/Desktop/Football Sim/test-results/e2e-1792537022298/viewport-100-season-report.png"
    },
    {
      "checkpoint": "final",
      "width": 390,
      "height": 844,
      "documentScrollWidth": 390,
      "bodyScrollWidth": 390,
      "pageOverflowPx": 0,
      "overflowElements": [],
      "screenshot": "/Users/kosi/Desktop/Football Sim/test-results/e2e-1792537022298/viewport-final.png"
    },
    {
      "checkpoint": "final-desktop",
      "width": 1280,
      "height": 900,
      "documentScrollWidth": 1280,
      "bodyScrollWidth": 1280,
      "pageOverflowPx": 0,
      "overflowElements": [],
      "screenshot": "/Users/kosi/Desktop/Football Sim/test-results/e2e-1792537022298/viewport-final-desktop.png"
    }
  ],
  "screenshots": [
    "/Users/kosi/Desktop/Football Sim/test-results/e2e-1792537022298/viewport-initial-load-desktop.png",